fecha,localidad,pais,numero_victimas,numero_heridos,descripcion,latitude,longitude
1983-03-27,San Sebastián,,1,0,"ETA  colocó un artefacto explosivo junto a un comercio donostiarra en el que se  vendían tejidos y llamó para advertirle sobre ello a la Policía Municipal. Al  lugar se trasladó la Policía Nacional que, tras instalar un cordón de  seguridad, comenzó con el operativo de desactivación del artefacto, puesto  que no podía estallarlo al estar colocado en una calle estrecha, en la que  los daños materiales serían enormes. Los Tedax Aniano Sutil Pelayo y Juan  Manuel Martínez Aguiriano se acercaron a la bomba para examinarla, pero  entonces se produjo la explosión que los alcanzó de lleno. Como consecuencia,  Aniano falleció en el acto y Martínez resultó herido muy grave, sufriendo  también la amputación de una pierna.",-1.9838889,43.3224219
1983-05-04,Bilbao,,1,0,"Cuatro  días antes de las elecciones municipales, un comando de ETA asesinó al  teniente de la Policía Nacional Julio Segarra Blanco y el cabo Pedro Barquero  González y su mujer embarazada de tres meses, María Dolores Ledo García. Con  la intención de secuestrarlo, los terroristas esperaron en el garaje en el  que guardaba su coche a Julio Segarra, a quien, al aparecer, lo ataron de  pies y manos con alambres y le amordazaron la boca. Fue entonces cuando, por  casualidad, apareció el cabo Pedro Barquero junto a su mujer y se desató un  tiroteo entre el policía y los terroristas que se saldó con la muerte del  matrimonio. Los terroristas asesinaron entonces también al teniente Barquero  y se dieron a la fuga.",-2.9349915,43.2630051
1983-05-04, Gernika-Lumo,,1,0,"Un guardia  civil resultó herido en un atentado perpetrado en la localidad vizcaína de  Guernica. Varios individuos dispararon con armas automáticas desde un coche  contra la dotación de la Guardia Civil que hacía servicio de vigilancia en  una fábrica de armas. El ataque terrorista se prolongó por espacio de unos  tres minutos y fue repelido por los guardias de servicio, uno de los cuales  resultó herido en la cabeza, el agente Donato Bandera Dolza.",-2.6778511,43.3143628
1983-06-16,Markina,,1,0,"Eduardo  Vadillo Vadillo, jefe de ventas de un concesionario de coches, adelantaba con  su vehículo al teniente coronel de la Guardia Civil José Llull Catalá, el  objetivo de los terroristas esa mañana. Por culpa de la espesa vegetación,  los criminales confundieron un coche con otro, e hicieron detonar el  explosivo a la altura del conducido por Eduardo Vadillo. El vehículo saltó  por los aires, desplazándose más de 20 metros. Gravemente herido, Vadillo  falleció en el hospital de Basurto.",-2.811342095,42.98026485
1983-06-22,Pasajes de San Juan,,1,0,"El  agente de la Guardia Civil Juan Maldonado Moreno fue asesinado por ETA  mediante un artefacto explosivo colocado bajo su automóvil. En el momento en  que Maldonado se disponía a arrancar el vehículo, este hizo explosión y se  llevó la vida del guardia civil. Además, una ciudadana portuguesa resultó  levemente herida y varios coches que se encontraban por la zona sufrieron  daños.",-1.9198872,43.3271675
1983-06-27, Pamplona,,1,0,"Jesús Blanco  Cereceda trabajaba como jefe de comunicaciones del aeropuerto de Noáin, al  lado de Pamplona. Tres terroristas lo estaban esperando a la mañana antes de  ir a su trabajo, junto a su porta. Cuando Blanco apareció, uno de ellos se le  acercó y le disparó tres veces a bocajarro. Blanco murió antes de llegar al  hospital.",-1.6442556,42.8184538
1983-07-13,Sopelana,,1,0,"El  agente de la Guardia Civil Manuel Francisco García San Miguel terminó su  jornada laboral en el cuartel de Getxo y, tras vestirse de paisano, se  dirigió a Sopelana, localidad en la que residía, en tren. Al salir del tren,  dos individuos se le acercaron y le pegaron dos tiros en la cabeza, para  después rematarlo cuando ya estaba en el suelo.",-2.983601783,43.37752705
1983-07-23,Vitoria-Gasteiz,,1,0,"El  empresario Ramiro Salazar Suero fue asesinado por ETA cuando entraba en el  establecimiento de su propiedad en el que se dedicaba a la compraventa de  vehículos. Dos individuos lo estaban esperando por la zona y, al verlo, se le  acercaron y le dispararon en la cabeza, quitándole la vida.",-2.6724025,42.8465088
1983-07-31,Bilbao,,1,0,"La  sede del Gobierno Militar de Vizcaya recibió el impacto de una granada que no  produjo desgracias personales aunque sí causó daños en el edificio. El  artefacto, que fue disparado con un lanzagranadas, alcanzó una de las paredes  del inmueble y rompió cristales de dicho edificio y de las viviendas  cercanas.",-2.9349915,43.2630051
1983-08-05, Oiartzun,,1,0,"El policía  municipal donostiarra Manuel Peronié Díaz se encontraba con su amigo Víctor  Zabala en Oiartzun, de madrugada puesto que eran fiestas patronales,  dispuestos a volver a sus domicilios. Caminando fueron sorprendidos por tres  miembros de ETA que sacaron sus armas y les obligaron a ir con ellos, con la  intención de secuestrarlos. En un momento en el que los terroristas se  descuidaron, Peronié y Zabala huyeron corriendo, pero uno de los terroristas  abrió fuego de metralleta contra ellos. Los tres disparos que recibió Peronié  acabaron con su vida. Zabala resultó herido, al igual que una pareja que  circulaba en moto: Coro Izagirre e Iñigo Bengoetxea.",-1.8596587,43.2984861
1983-09-04,Pamplona,,1,0,"Tres  explosivos de Goma 2 (lanzados, al parecer, desde una moto) hicieron  explosión en el colegio mayor Goimendi y en la facultad de Teología de la  Universidad de Navarra, en Pamplona, causando destrozos materiales de escasa  consideración. Una de las residentes en el colegio hubo de ser atendida en la  clínica universitaria de Pamplona de molestias en los oídos como consecuencia  de la fuerte explosión.",-1.6442556,42.8184538
1983-09-05,Hernani,,1,0,"El  propietario de un bar en Hernani Arturo Quintanilla Salas fue tiroteado por  miembros de ETA en presencia de su mujer y su hija de 15 años en el momento  en el que accedía a su vehículo, después de salir del bar de su propiedad.  Como consecuencia de los disparos Quintanilla perdió la vida. Había sido  amenazado en varias ocasiones y ETA le había enviado varias cartas de  extorsión reclamándole dinero.",-1.9747419,43.2661107
1983-09-06,San Sebastián,,1,0,"Dos  terroristas de ETA asesinaron a Javier Alberdi, representante de comercio de  dos empresas que vendían licores, cuando éste viajaba en su vehículo y los  agresores, al intentar sacarlo de él, forcejearon y le dispararon tres veces.  Alberdi murió en el momento, puesto que una de las balas le alcanzó el  corazón.",-1.9838889,43.3224219
1983-09-16, Urnieta,,1,0,"El policía  nacional Pablo Sánchez César se dirigía a su trabajo en San Sebastián vestido  de paisano, y se encontraba esperando para ello al tren en la estación de  Urnieta. Mientras esperaba, tres sospechosos se le acercaron y él intentó  protegerse en el edificio de la estación, pero los agresores lo dispararon y  uno de ellos lo remató de un disparo en la cabeza. Los tres terroristas se  dieron a la fuga en un coche que habían robado previamente.",-1.9917045,43.24687
1983-09-20,Logroño,,1,0,"El  policía nacional Mariano Rama, su esposa y una vecina resultaron heridos de  forma leve por la explosión de un artefacto de Goma-2 colocado en un pasaje  que comunica el cuartel de la Policía Nacional en Logroño con las viviendas  familiares del cuerpo. Rama, que se encontraba en el interior de su vehículo  esperando a su familia, fue atendido de pequeños cortes por toda la cara y  antebrazos, causados por los cristales del propio coche. Su mujer y su hija  fueron arrojadas al suelo por efecto de la onda expansiva. El atentado fue  reivindicado por una sección de ETA (p-m) que se quería integrar en ETA  militar.",-2.4396676,42.4661196
1983-09-26,San Sebastián,,1,0,"ETA  colocó una bomba en el economato militar de San Sebastián, sin que se  produjeran daños personasles. Eso sí, la onda explosiva produjo daños en el  interior del inmueble y en sus cristales, así como en algunas viviendas y  comercios. También produjo desperfectos en un automóvil aparcado en las  cercanías del edificio.",-1.9838889,43.3224219
1983-09-28,Castro Urdiales,,1,0,"Una  bomba colocada por milikis,  una escisión de ETA (p-m), junto a una caseta de la Guardia Civil en el  puerto de Castro Urdiales alcanzó al pescador Gregorio Olabarrieta Fernández,  de 30 años de edad, quien resultó con contusiones leves. La explosión  ocasionó diversos destrozos en el edificio y otros locales cercanos,  estimados todos ellos por el Ayuntamiento castreño en 1,5 millones de  pesetas, pero sin que dañara gravemente la vivienda situada en el piso  superior del inmueble y que ocupa el guardamuelles del puerto.",-3.2162576,43.3843347
1983-10-03, Portugalete,,1,0,"El policía  nacional Manuel Benito José fue asesinado de dos tiros mientras se encontraba  en el interior de un bar hablando con un par de personas. Dos jóvenes  entraron en el local y le dispararon por dos veces. En el bar, además del  policía herido, se encontraban otras tres personas, entre ellas el  propietario del establecimiento.Benito terminó falleciendo en el hospital dos  días después del atentado, estando en coma profundo.",-3.0199529,43.3191292
1983-10-05,Galdácano,,1,0,La  escisión de ETA (p-m) VIII Asamblea secuestró durante 13 días y asesinó de un  tiro en la sien al capitán de Farmacia Alberto Martín Barrios en Bilbao.  Martín fue secuestrado tras salir de su domicilio para ir al trabajo. Los  terroristas exigieron la puesta en libertad de miembros de la banda que  participaron en un atentado contra el cuartel del Ejército en la localidad  catalana de Berga un par de años atrás. El cuerpo del militar apareció en una  caseta cercana a Galdácano.,-2.8453385,43.2332639
1983-10-08,Hernani,,1,0,"El  herborista y encofrador Juan José Pulido Pavón fue asesinado cuando se montó  en la parte trasera de un coche acompañado de dos amigos, después de salir de  un bar a la noche. Antes de arrancar el coche, un terrorista se acercó y  disparó cuatro veces desde la ventanilla sobre el cuerpo de Pulido. ETA  reivindicó el atentado acusando a Pulido de estar relacionado con el  narcotráfico.",-1.9747419,43.2661107
1983-10-13, Renteria,,1,0,"El guardia  civil Ángel Flores Jiménez fue asesinado por dos miembros de ETA en el  momento en que se disponía a salir de su coche para dirigirse a su casa. En  ese instante lo abordaron y le dispararon tres veces, impactando una de las  balas en el cuello. Flores perdió la vida en el momento y los terroristas  escaparon en un coche robado previamente a cuyo dueño dejaron atado a un  árbol.",-1.8986133,43.3125271
1983-10-15,Cádiz,,1,0,"El  médico argentino Alfredo suar Muro, trabajador de la prisión del Puerto de  Santa María, apareció muerto en el interior de su vehículo en Cádiz, con un  disparo en el cuello. Había sido secuestrado en su propia consulta y  asesinado en su coche. Al reivindicar el atentado, ETA amenazó de muerte a  todos los funcionarios de prisiones.",-6.2928976,36.5297438
1983-10-15,Oñate,,1,0,"Una  patrulla de la Guardia Civil formada por tres vehículos circulaba por una  zona de Oñati cuando miembros de ETA activaron una bomba a distancia que  alcanzó de lleno al primero de los vehículos. Como consecuencia, falleció el  agente José Reyes Corchado Muñoz y resultaron heridos leves el conductor y el  agente Antonio Ramos Ramírez.",-2.4137149,43.0328523
1983-10-20, Rentería,,1,0,"El panadero  Cándido Cuña González fue asesinado cuando salió de un bar y se dirigía a su  casa. Dos encapuchados se le acercaron y le dispararon a bocajarro. Al caer  al suelo, uno de los terroristas lo remató. Cuña ya había sido víctima de un  atentado en el que resultó herido en 1979. ETA lo acusó de ser colaborador de  la Policía.",-1.8986133,43.3125271
1983-10-26,Irún,,1,0,"Dos  terroristas de ETA penetraron en la carnicería de Lorenzo Mendizabal  Iturrarte, que se encontraba atendiendo a unos clientes y en compañía de otro  trabajador de la carnicería, y le dispararon dejándolo herido de muerte. Los  etarras escaparon en el taxi que previamente habían robado. El propietario  del vehículo fue encontrado en el maletero del mismo. ETA lo acusó de tener  una estrecha relación con el guardia civil también asesinado Juan Maldonado.",-1.7888095,43.3383176
1983-11-05,Villabona,,1,0,"El  obrero en paro Manuel Carrasco Merchán salió de un bar camino de su domicilio  cuando, sin saberlo, pasó por delante de un piso en el que había varios  miembros de ETA que lo reconocieron y, después, salieron a la calle a  buscarlo y dispararlo a quemarropa. Los tiros recibidos en cabeza y tórax  acabaron con la vida de Carrasco, quien llevaba en el punto de mira  terrorista desde hacía dos años.",-2.0534727,43.1876792
1983-11-08,Beasain,,1,0,"Un  comando armado de ETA acudió a la casa del industrial afín al PNV y  presidente del Consejo de Administración de Indar, SA José Cruz Larrañaga y  allí le encerró junto a su mujer y dos hijas para después secuestrarlo  durante 11 días. Fue liberado a cambio de una suma de dinero.",-2.2032868,43.0473269
1983-11-09, Bilbao,,1,0,"El comerciante  y camarero en el bar de la Hermandad de Antiguos Legionarios José Angel  Martínez Trelles, quien además había sido legionario paracaidista, fue  asesinado cuando se encontraba en dicho bar charlando. Dos miembros de ETA  entraron en el local y uno de ellos se dirigió a la barra y disparó a  Martínez.",-2.9349915,43.2630051
1983-11-12,Bermeo,,1,0,El  teniente de Navío de la armada Antonio de Vicente Comesaña fue asesinado  cuando se encontraba en una plaza de Bermeo. Dos individuos se le acercaron  por detrás y lo dispararon desde cerca. Las balas recibidas en la cabeza y el  pecho le quitaron la vida.,-2.7231562,43.4194242
1983-11-26,Vitoria-Gasteiz,,1,0,"ETA  asesinó a tiros a José Antonio Julián Bayano, dueño de varios locales  nocturnos, en las afueras de Vitoria. Julián salía de uno de sus locales  hacia las 4 de la madrugada y, cuando se disponía a entrar en su vehículo,  fue alcanzado por cinco balazos en el cuerpo. Al reivindicar el crimen, ETA  acusó a Julián de ser militante de Fuerza Nueva y ser colaborador de la  Policía.",-2.6724025,42.8465088
1983-12-08, Zegama,,1,0,"El vendedor de  automóviles Francisco Javier Collado Azurmendi fue asesinado por terroristas  de ETA después de que saliera de un bar de jugar a billar con unos amigos.  Tras salir del local, Collado recibió tres impactos de bala en la cabeza y  sus agresores se dieron a la fuga en un automóvil que los esperaba cerca. Una  de las balas rebotó en una pared e hirió en una pierna a otro cliente del  bar, Juan Sarraoa Gallastegi.",-2.29036,42.9758091
1983-12-09,Renteria,,1,0,"El  taxista jubilado Pablo Garraza García fue secuestrado, interrogado y  posteriormente asesinado de un tiro en la cabeza por ETA. Su cuerpo fue  encontrado en un pequeño bosque y se encontraba tumbado boca abajo. En  Rentería se relacionaba a Garraza con el tráfico de drogas. Además de este  atentado mortal, ese mismo día ETA cometió dos atentados más que resultaron  fallidos. En uno de ellos, un joven teniente de infantería salvó su vida  tirándose al suelo cuando lo dispararon en Pasajes. En el otro atentado, una  bomba colocada en la autopista entre Bilbao y San Sebastián a la altura de  Usurbil (Gipuzkoa) alcanzó al último conche de un convoy de la Guardia Civil,  resultando ilesos todos los ocupantes.",-1.8986133,43.3125271
1983-12-15,San Sebastián,,1,0,"El  policía nacional Eduardo Navarro Cañada y su compañero Clemente Medina  Monreal patrullaban por las calles del centro de San Sebastián cuando dos  miembros de ETA se les acercaron y dispararon a bocajarro, para después darse  a la fuga en un automóvil robado a dos policías municipales, a quienes  también robaron los uniformes. Como consecuencia de los disparos, el agente  Navarro falleció en el hospital, mientras que Clemente Medina resultó herido  de gravedad pero pudo salvar su vida. Aún así, Medina no pudo volver a  ejercer su profesión. También fue herido de bala un viandante.",-1.9838889,43.3224219
1983-12-16,Bardenas Reales,,1,0,"ETA  atentó con varios artefactos explosivos contra el acuartelamiento que el  Ejército del Aire tiene en el polígono de tiro de Las Bardenas Reales, y en  el que, como consecuencia de la explosión de unos aproximadamenete 40 kilos  de Goma 2, resultaron gravemente dañadas sus instalaciones y heridos de  carácter leve un teniente y dos soldados.",-1.466250728,42.1611684
1984-01-11, Bilbao,,1,0,"Atentado con  bomba contra la sede de las empresas de Olarra SA. El atentado pudo estar  relacionado, bien con una situación laboral en la que una reestructuración  iba a tener como consecuencia más de 800 despidos, bien con las  especulaciones sobre la eventual participación de empresarios vascos en la  financiación de la llamada guerra sucia. En el momento de la explosión 40  personas se encontraban en el interior del edificio.",-2.9349915,43.2630051
1984-01-29, Madrid,,1,0,"El Teniente  General del Ejército Guillermo Quintana Lacaci fue asesinado por un comando  de ETA en el momento en que salía junto a su esposa de una misa. Dos  terroristas se acercaron al matrimonio y dispararon contra el militar,  rematándolo en el suelo. Su esposa se abalanzó sobre uno de los terroristas  para impedir que dispararan, pero ella también fue herida en una pierna.  También fue herido el coronel Gil Pachón, quien acababa de saludar a  Quintana.",-3.7035825,40.4167047
1984-02-04,Getxo ,,1,0,"Mikel  Solaun Angulo se había reinsertado en la sociedad y rehecho su vida después  de haber estado en la cárcel por haber sido miembro de ETA militar. Solaun  era ingeniero industrial y constructor de profesión. Después de ser  considerado por ETA un traidor y haber estado amenazado en la cárcel y en la  calle, ETA decidió asesinarlo en presencia de su mujer y sus dos hijas,  después de que dos terroristas lo localizaran en un bar de Algorta y lo  dispararan con sus pistolas.",-3.0087671,43.3479409
1984-03-01, Vitoria-Gasteiz,,1,0,"El inspector de  Policía retirado Pedro Ortiz de Urbina Garayalde fue asesinado por tres  miembros del Comando Araba de ETA en su domicilio. Para ello, los terroristas  secuestraron al conductor de un coche y fueron al edificio donde vivía Ortiz  de Urbina, a la vivienda de los conserjes. Allí dejaron atados al dueño del  coche y al marido de la portera del edificio, a quien obligaron a bajar con  ellos a la casa del expolicía. Cuando la portera llamó al timbre y fue vista  por Ortiz de Urbina, este abrió confiado y, pese a darse cuenta rápido de que  iban a atentar contra él, fue abatido con cuatro disparos que le causaron la  muerte. La víctima se había quedado en Vitoria pese a haber recibido varias  amenazas de muerte.",-2.6724025,42.8465088
1984-03-27, Elorrio,,1,0,"El agente de la  Policiía Municipal de Elorrio José Naranjo Martín fue asesinado cuando,  uniformado pero desarmado, se encaminaba por la noche hacia su puesto de  trabajo. Dos miembros de ETA se le acercaron por la espalda y le dispararon  varias veces. Los dos disparos que recibió en la cabeza le quitaron la vida y  los asesinos escaparon en el coche que habían robado antes en Durango,  después de dejar a su dueño amarrado a un árbol en el monte. ETA acusó a  Naranjo de ser confidente desde la época de Franco.",-2.5426453,43.1304644
1984-04-02,Bilbao,,1,0,"El  policía nacional Bernardo Pérez Sobrino acudió después de comer, como de  costumbre, a jugar una partida de cartas y tomar un café con sus amigos a un  bar en Bilbao. Tras él entró al local un desconocido que, después de pedir  una consumición, disparó a bocajarro al agente, hiriéndolo de muerte en el  cuello. Además, una de las balas alcanzó al propietario del bar, Lisardo  Landeta Olalde, herido en un brazo.",-2.9349915,43.2630051
1984-04-06,Galdácano,,1,0,"José  Verdú Ortiz, policía nacional, fue asesinado por dos miembros de ETA cuando  se disponía a entrar en el portal de su casa. Los terroristas lo estaban  esperando en el lugar, después de haber robado un coche y atado a su dueño a  un árbol en un monte próximo a Galdácano. Verdú se percató de que iba a ser  atacado y sacó su pistola, pero no le dio tiempo a repeler el ataque. Tras  doce días gravemente herido en el hospital, Verdú falleció el 18 de abril.",-2.8453385,43.2332639
1984-04-13, Pamplona,,1,0,"Jesús Alcócer  Jiménez, comandante retirado del Ejército de Tierra y antiguo militante de  Fuerza Nueva, fue asesinado por dos miembros de ETA cuando se disponía a  entrar en el mercado de alimentos donde compraba para los tres supermercados  que dirigía. Los terroristas lo abatieron con dos disparos en la cabeza que  le quitaron la vida al instante. Los etarras escaparon en un coche robado que  después abandonaron con una bomba-trampa en su interior. Cuando dos agentes  de la Policía Nacional se acercaron para inspeccionar el coche, el explosivo  detonó y se llevó sus vidas por delante. Eran el cabo primero Tomás Palacín  Pellejero y el agente Juan José Visiedo Calero. Otro policía resultó  levemente herido.",-1.6442556,42.8184538
1984-04-21,Bilbao,,1,0,"El  agente de la Guardia Civil Antonio Velasco Benito se encontraba de guardia en  una de las puertas de la Audiencia Territorial de Bilbao en el momento en el  que un coche ocupado por tres miembros de ETA circulaba lentamente por  delante del edificio. Al llegar a la altura de Velasco, abrieron fuego contra  él para después acelerar y darse a la fuga. Velasco recibió dos balazos en la  cabeza y otro en una pierna y falleciendo posteriormente en el hospital.",-2.9349915,43.2630051
1985-05-03,Irun,,1,0,"Ángel  Rodríguez Sánchez era el propietario de un taller mecánico que acudió a un  servicio que le requería el uso de su grúa para transportar un coche  averiado. Al llegar al vehículo averiado, sus dos ocupantes resultaron ser  miembros de ETA y le obligaron a ir a un lugar menos transitado para  interrogarle y asesinarle.",-1.7888095,43.3383176
1984-05-27,Pamplona,,1,0,"El  capitán de la Guardia Civil Luis Ollo Ochoa se disponía a coger el coche  junto a su esposa, Esther Pérez de Aramendi. El capitán Ollo accionó el motor  del automóvil antes de que su esposa subiera al mismo, y en ese momento la  vibración del motor hizo estallar una bomba colocada bajo el coche. Ollo, que  había sido amenazado de muerte en varias ocasiones, falleció en el acto. Su  mujer sufrió diversas heridas y tuvo que ser trasladada al hospital.",-1.6442556,42.8184538
1984-06-07,Pamplona,,1,0,"Diego  Torrente Reverte, policía nacional, se encontraba limpiando su coche en la  calle cuando dos miembros de ETA se le acercaron para robarle el vehículo,  sin saber que Torrente era policía. Pensando que le iban a matar, Torrente se  abalanzó sobre los agresores y, durante el forcejeo, recibió un disparo en la  cara a corta distancia que le quitó la vida.",-1.6442556,42.8184538
1984-06-14, San Sebastián,,1,0,"El guardia  civil Ángel Zapatero Antolín fue asesinado por ETA cuando iba a coger su  coche. Accionó el motor y la vibración hizo estallar un artefacto colocado en  los bajos del automóvil, haciendo saltar al vehículo por los aires. Zapatero  murió al instante, y además la onda expansiva alcanzó a un niño de  nacionalidad portuguesa, José Evangelista Matías, que tuvo que ser trasladado  al hospital.",-1.9838889,43.3224219
1984-06-18,Ispaster,,1,0,"Manuel  Vicente González Viloria, secretario del Ayuntamiento de Ispaster, fue  asesinado de un balazo en la plaza del pueblo después de visitar unas obras  junto al alcalde. Sus dos agresores se dieron a la fuga en un coche que los  estaba esperando cerca de donde hicieron el atentado. González, que había  tenido escolta durante un tiempo, ya sufrió tres años antes un intento de  atentado que no pudieron llevar a cabo los etarras.",-2.553107681,43.35652965
1984-07-02,Portugalete,,1,0,"Alberto  Aznar Feix, teniente coronel retirado del Ejército, solía dar paseos todas  las mañanas con su madre de 92 años de edad. Cuando esa mañana volvían a su  domicilio y se pararon a hablar con unas vecinas, uno de los dos terroristas  que lo estaban esperando se le acercó y le asesinó de un tiro a bocajarro.",-3.0199529,43.3191292
1984-07-19, Portugalete,,1,0,El agente de la  Guardia Civil Antonio Torrón Santamaría fue asesinado de un tiro en la cabeza  en el momento en que iba a entrar en su domicilio. Dos terroristas se le  acercaron por la espalda y le dispararon un tiro que le causó la muerte.,-3.0199529,43.3191292
1984-07-25,Lekeitio,,1,0,"Juan  Rodríguez Rosales era agente de la Policía Municipal de Lekeitio. El mediodía  del 25 de julio, salió de su casa uniformado pero desarmado para dirigirse al  cuartel en el que trabajaba, pero dos etarras lo estaban esperando cerca de  su puesto de trabajo y uno de ellos lo asesinó de un único disparo en la  cabeza.",-2.5059965,43.3637081
1984-09-21,Valle de Trápaga,,1,0,"El  comerciante de oro y aparatos electrónicos residente en Portugalete José  María Martínez Martínez-Cubero fue secuestrado por ETA y se lo llevaron en su  propio automóvil, donde lo asesinaron de un disparo en la cabeza. Los  terroristas dejaron su cuerpo abandonado junto a una mina, atado de pies y  manos en el municipio de San Salvador del Valle, en el Valle de Trápaga.",-3.0379311,43.3047516
