fecha,localidad,pais,numero_victimas,numero_heridos,descripcion,latitude,longitude
1985-12-23, Pamplona,,1,0,"Tras cuatro  intentos de asesinato por parte de ETA contra el general de Brigada de la  Guardia Civil Juan Atarés Peña, quien había rechazado llevar escolta, el  quinto intento terminó con su vida. Atarés se encontraba paseando por un  parque cercano a su casa y dos etarras se bajaron de un coche robado  previamente en el que les esperaba un tercer compañero. Se acercaron a Atarés  por la espalda y los tres tiros que recibió en la cabeza lo mataron al  instante.",-1.6442556,42.8184538
1985-12-30,Lasarte-Oria,,1,0,"El  exguardia civil Alejandro Sáenz Sánchez se disponía a trabajar por último día  antes de su prejubilación en una nave industrial en la que él era el  vigilante jurado. Sin embargo, dos miembros de ETA lo estaban esperando en el  parking de la fábrica y se le acercaron para dispararle varias veces. Dos  disparos le alcanzaron la cabeza y fue rematado en el suelo, por lo que Sáenz  perdió la vida casi al instante. Los terroristas escaparon en el taxi que  habían robado previamente, a cuyo dueño además habían dejado atado a un  árbol.",-2.0193784,43.2684642
1985-12-30,Lezama,,1,0,"El  empresario y directivo del club de fútbol Athletic de Bilbao, Juan Pedro  Guzmán Uribe, fue secuestrado por tres individuos de ETA después de una  comida entre directivos de dicho club y periodistas. La enérgica reacción en  contra del club vizcaíno y sus jugadores, con un potentísimo arraigo en la  sociedad, debilitó la posición de la banda terrorista. Tras once días de  cautiverio, Guzmán fue rescatado por los 'geos' en una operación policial sin  disparos y en la que los secuestradores fueron convencidos para que se  entregaran.",-2.8329246,43.2743248
1986-02-04,Rentería,,1,0,"La  niña de nueve años Noelia Espinosa Magallón y su padre, el cabo de la Policía  Nacional Manuel Espinosa Asenjo, resultaron gravemente heridos en Rentería  por la explosión de una potente bomba colocada bajo el vehículo de este  último. El policía nacional perdió la pierna derecha, y su hija sufrió graves  lesiones de metralla en el ojo derecho, el oído izquierdo, la cabeza y las  piernas. El atentado se produjo a una de hora de tránsito en un lugar de paso  obligado para escolares.",-1.8986133,43.3125271
1986-02-06,Madrid,,1,0,"El  vicealmirante de la Armada Cristóbal Colón de Carvajal y Maroto y el  conductor de su vehículo oficial Manuel Trigo Muñoz, fueron asesinados por  dos miembros de ETA cuando se dirigían en el coche al lugar de trabajo del  vicealmirante. Los terroristas se encontraban a la espera, ocultos en un  lugar por el que debía pasar el vehículo y al paso de este lo ametrallaron.  Trigo perdió el control del vehículo, que se estrelló contra otro automóvil y  los terroristas se acercaron en ese momento y tiraron una granada dentro del  mismo, para darse a la fuga en otro coche en el que les esperaba un tercer  compañero. Colón de Carvajal y Trigo murieron en el acto, mientras que el  comandante de infantería Antonio Rodríguez-Toubes quedó gravemente herido  durante 1.096 días en el hospital y sufrió graves secuelas.",-3.7035825,40.4167047
1986-03-10, Lasarte-Oria,,1,0,"José María  Egaña Loidi, de 61 años, presidente del Consejo de Administración de Krafft,  SA -dedicada a la fabricación de lubricantes, detergentes y productos  similares para automóviles-, y consejero de las empresas Ibarrondo, Igepac y  de la desaparecida Bianchi, fue secuestrado por ETA y liberado 19 días  después, después de que su familia pagara el rescate.",-2.0193784,43.2684642
1986-03-14,San Sebastián,,1,0,"Dos  agentes que se encontraban en un coche camuflado de la Policía Nacional  observaron a dos miembros de ETA en el momento en que se encontraban  colocando un artefacto explosivo por un paseo donostiarra. Los agentes se les  acercaron para pedirles la documentación, pero uno de los terroristas  disparó, hiriendo en el corazón mortalmente a José Antonio Álvarez Díez. El  compañero del policía reaccionó al ataque y también disparó mortalmente al  etarra agresor, Ángel María Galarraga Mendizabal, mientras el otro terrorista  se dio a la fuga.",-1.9838889,43.3224219
1986-03-20,Zumaia,,1,0,"José  Ignacio Aguirrezabalaga de la Granja fue asesinado por ETA acusado de ser  colaborador de los GAL. Arrizabalaga se encontraba trabajando como camarero  en un bar de Zumaia cuando entraron en el local dos terroristas que abrieron  fuego contra él, mientras otro esperaba fuera. Seis disparos acabaron con su  vida. Los etarras escaparon en un vehículo previamente robado, en el que  llevaban metido en el maletero al dueño, liberado tras el atentado.",-2.2571182,43.296653
1986-04-25, Madrid,,1,0,"ETA hace  explotar un coche-bomba al paso de un vehículo ocupado por nueve guardias  civiles de los que resultaron heridos cuatro y murieron los otros cinco: Juan  Carlos González Rentero, Vicente Javier Domínguez González, Juan José Catón  Vázquez, Juan Mateos Pulido y Alberto Amancio Alonso Gómez. Los efectos de la  explosión también hirieron a siete transeúntes.",-3.7035825,40.4167047
1986-05-02,San Sebastián,,1,0,"Enrique  Moreno Arguilea, jubilado, fue confundido con un antiguo policía y ese fue el  motivo por el que ETA lo localizó, vigiló y asesinó. Moreno siempre acudía al  mismo bar para jugar a las cartas. Dos terroristas lo esperaron a que llegara  a dicho local para su partida de cartas y uno de ellos lo disparó en la nuca  a corta distancia, quitándole la vida. Días más tarde ETA reconoció haber  cometido un error.",-1.9838889,43.3224219
1986-05-08,Madrid,,1,0,"Antonio  Hernández Gil, presidente del Consejo General de¡ Poder Judicial, resultó  ileso en el atentado terrorista que sufrió ayer en Madrid cuando tres  granadas anticarro colocadas en el maletero de un automóvil fueron disparadas  a distancia y penetraron en el vehículo oficial, también por el maletero,  pero no estallaron. El coche empleado por los terroristas había sido  estacionado en doble fila para disparar las granadas cuando el vehículo de  Hernández Gil estuviera a su altura. Uno de los tres artefactos penetró en el  coche a pocos centímetros de la espalda del presidente del poder judicial.",-3.7035825,40.4167047
1986-05-20, Arrigorriaga,,1,0,"El policía  nacional Manuel Fuentes Pedreira era aficionado a jugar en el frontón de la  localidad de Arrigorriaga. Después de jugar un partido y estando sentado, dos  terroristas de ETA se sentaron detrás de él y, sin mediar palabra, uno de  ellos le disparó una vez en la nuca, quitándole la vida. Los terroristas  escaparon en un taxi robado previamente y a cuyo volante les esperaba un  tercer compañero.",-2.8873537,43.2065921
1986-06-08,Mondragón,,1,0,"El  guardia civil Antonio Ramos Ramírez fue asesinado por ETA cuando salía de un  bar en la localidad de Mondragón y se dirigía a su coche. La víctima iba  vestida sin uniforme y los terroristas se acercaron a su vehículo y lo  ametrallaron, dejándole herido de muerte.",-2.4900779,43.0656783
1986-06-09,Hernani,,1,0,"ETA  Militar hizo explotar, sin causar víctimas mortales, un coche bomba al paso  de un convoy de la Guardia Civil. El coche bomba, cargado de explosivos y  tornillería estalló en el barrio Carabel de Hernani, hirió levemente a dos  trabajadores y provocó el pánico entre la población de esta zona urbana. La  explosión derribó la pared de un taller mecánico, dañó los vehículos  estacionados en las inmediaciones y por el efecto de la onda expansiva  destruyó los cristales de las viviendas en una amplia área.",-1.9747419,43.2661107
1986-06-17, Madrid,,1,0,"El teniente  coronel del Ejército Carlos Vesteiro Pérez, el comandante Ricardo Sáenz de  Ynestrillas (condenado junto a Antonio Tejero por el intento de golpe de  estado de 1981) y el soldado que conducía el vehículo Francisco Casillas  Martín fueron asesinados por ETA tras ser ametrallados por un comando. Las  familias de los tres militares rechazaron asistir al funeral oficial que se  celebró en el Cuartel General del Ejército.",-3.7035825,40.4167047
1986-06-27,Portugalete,,1,0,"El  comando Iraultza de ETA llamó a la policía de la localidad vizcaína de  Santurtzi para avisar de la colocación de una bomba en una máquina  perforadora que se estaba usando en las obras de una depuradora. La policía  no encontró el artefacto y abandonó el lugar. A la mañana siguiente, la bomba  explotó cuando el trabajador José Miguel Moros Peña accionó la máquina. Moros  Peña sufrió graves heridas en la cara y perdió una mano y quedó ingresado en  el hospital, hasta que el 13 de agosto terminó perdiendo la vida como  consecuencia de la gravedad de sus heridas.",-3.0199529,43.3191292
1986-06-28,Zarautz,,1,0,"La  explosión de un artefacto compuesto por goma 2 y metralla alcanzó un vehículo  de la Guardia Civil que patrullaba por la localidad guipuzcoana de Orio. Como  resultado, el agente José Luís Jiménez resultó herido y se puso en marcha una  patrulla de los GAR (Grupos Antiterroristas Rurales) perteneciente a la  Guardia Civil. Durante su misión, otra bomba explotó a su paso por el alto de  Meagas, una zona perteneciente al municipio de Zarautz. La explosión alcanzó  de lleno al vehículo en el que viajaban varios agentes de la Guardia Civil y  mató al instante a Francisco Muriel Muñoz e hirió a los también guardias  civiles Manuel Ángel Arenal Linares, José María Baltasar Gil, Juan Carlos  Carballo Gañán, Ramón Perona Sánchez, Luis Pérez Bao y José Carlos Marrero  Sanabria. Este último tuvo gravísimas secuelas debido a una insuficiencia  respiratoria y shock traumático que le causaron una lesión cerebral por la  que tuvo que ser internado en un psiquiátrico, donde falleció el 10 de enero  de 1988 después de suicidarse.",-2.1723467,43.2834873
1986-07-14, Madrid,,1,0,"La banda  terrorista ETA cargó una furgoneta con una enorme cantidad de dinamita y  metralla en la plaza de la República Argentina de Madrid, y al paso de un  convoy de la Guardia Civil compuesto por un autobús, un minibús y un  todoterreno, los terroristas hicieron explotar a distancia el vehículo en un  momento en el que en la zona había mucha gente. Como consecuencia del  atentado hubo 78 personas heridas y murieron doce agentes entre el día del  atentado y los posteriores, como consecuencia de las heridas: Jesús Jiménez  Jimeno, José Joaquín García Ruiz, Antonio Larrancharro Reyes, José Calvo  Gutiérrez, Miguel Ángel Cornejo Ros, Carmelo Bella Álamo, Jesús María Freixes  Montes, Santiago Iglesias Godino, Javier Esteban Plaza, Miguel Ángel de la  Higuera López, José Fernández Pertierra y Juan Ignacio Calvo Guerrero.",-3.7035825,40.4167047
1986-07-26,Aretxabaleta,,1,0,"Los  agentes de la Guardia Civil Adrián González Revilla e Ignacio Matéu Istúriz  se encontraban inspeccionando los alrededores del cuartel de la población de  Aretxabaleta, que horas antes había sido objeto de un ataque con granadas por  parte de ETA. En cierto momento de la inspección, un artefacto explotó y mató  a los dos agentes. Mateu era hijo del magistrado del Tribunal Supremo José  Francisco Mateu Cánoves, también asesinado por ETA en Madrid en 1978.",-2.5036785,43.0359732
1986-08-18, Legutiano,,1,0,El Coronel del  Ejército de Tierra José María Picatoste González de Echávarri fue asesinado  por dos miembros de ETA en el momento en que se subió a su automóvil tras  comer con varios familiares y amigos en un restaurante. Los cuatro disparos  que recibió le quitaron casi al instante la vida.,-2.6426345,42.9791587
1986-09-10,Ordizia,,1,0,"En  una céntrica plaza de la localidad de Ordicia es asesinada de un tiro la  dirigente de ETA en la década de los 70 Mª Dolores González Catarain  ""Yoyes"" cuando se encontraba paseando con su hijo. 'Yoyes' había  regresado a Euskadi desde América en 1985, tras acogerse a la amnistía de  1977. Este asesinato se entendió como un intento por parte de ETA de cerrar  las vías de la reinserción a la sociedad de antiguos activistas.",-2.1795046,43.0539687
1986-10-14,Barcelona,,1,0,"El  policía nacional Ángel González del Pozo falleció como consecuencia de los  efectos de la explosión de un coche-bomba colocado por ETA junto al cuartel  de la Policía Nacional de Belchite, en Barcelona. González del Pozo se  encontraba custodiando el edificio. Además, 10 civiles y cuatro policías  nacionales resultaron heridos de diversa consideración. Tres días después, se  adjudicó a Barcelona la organización de los Juegos Olímpicos. ETA especificó  en su comunicado de reivindicación que no se trataba de una campaña contra la  cita olímpica.",2.1774322,41.3828939
1986-10-15,Vitoria-Gasteiz,,1,0,"Lucio  Aguinagalde Aizpurua, industrial jubilado militante del PNV, fue secuestrado  por ETA y liberado por las fuerzas de la Ertzaintza 18 días después.  Aguinagalde fue secuestrado por no pagar a ETA el impuesto revolucionario que  le reclamaba, y en la operación por su liberación murió el agente Genaro  García de Andoain Larrinaga en el enfrentamiento producido frente a los  terroristas.",-2.6724025,42.8465088
1986-10-25, San Sebastián,,1,0,"Dos miembros de  ETA a bordo de una moto se situaron junto al coche oficial que llevaba al  Gobernador Militar Guipuzcoa Rafael Garrido Gil, su esposa Daniela Velasco y  su hijo Daniel Garrido Velasco, además del conductor oficial. El etarra que  iba detrás posó una bolsa de deporte cargada de explosivo que estalló y mató  a los tres miembros de la misma familia e hirió al conductor. Como  consecuencia de los efectos de la onda expansiva, resultaron heridas, además,  14 personas. Entre ellas, la ciudadana portuguesa María José Teixeira  Gonçalves, que moriría el 11 de noviembre, como consecuencia directa de las  heridas sufridas en el atentado.",-1.9838889,43.3224219
1986-10-28,Bilbao,,1,0,"El  policía nacional Julio César Sánchez Rodríguez se encontraba acompañando a  sus hijos a casa después de su día en el colegio cuando un terrorista se le  acercó por detrás y lo mató con un único disparo en la nuca. El terrorista  escapó en un taxi en el que lo esperaba otro compañero, después de que lo  hubieran robado y secuestrado a su dueño a punta de pistola.",-2.9349915,43.2630051
1986-11-02,Ubidea,,1,0,"Un  grupo de la Ertzaintza dirigido por Genaro García de Andoain Larrinaga acudió  a una cueva para liberar al empresario alavés y amigo de García de Andoain  secuestrado, Lucio Aguinagalde. En el operativo, al ir a entrar a la cueva en  la que había descubierto que se encontraba el secuestrado, los tres  terroristas que lo custodiaban abrieron fuego, alcanzando e hiriendo de  muerte a García de Andoain. Dos terroristas fueron detenidos, mientras el  otro consiguió escapar, y Aguinagalde fue liberado ileso.",-2.6888828,43.0241516
1986-12-10,Villabona,,1,0,"El  industrial Jaime Caballero Urdanpilleta, director gerente de Papelería Oria,  fue secuestrado por ETA cuando se dirigía a su trabajo. 59 días después del  secuestro fue liberado tras el pago de un rescate, después de que los  terroristas lo dejaran atado a un árbol en el Alto de Arrate, cercano a  Eibar.",-2.0534727,43.1876792
1987-01-30, Zaragoza,,1,0,"Un autobús  lleno de militares y docentes que acudían a la Academia Militar de Zaragoza  fue víctima de la explosión de una furgoneta-bomba accionada a distancia por  miembros de ETA. Víctimas del atentado murieron el conductor del autobús,  Ángel José Ramos Saavedra y el Comandante de Ingenieros del Ejército Manuel  Rivera Sánchez. 40 personas más resultaron heridas (13 civiles y 27  militares) y se produjeron cuantiosos daños materiales.",-0.8809428,41.6521342
1987-02-19,Bilbao,,1,0,"María  Luisa Sánchez Ortega trabajaba en la limpieza y, tras un día de trabajo, se  disponía a volver a pie a su domicilio. Al pasar por al lado de un  concesionario de coches, la explosión de una bomba colocada por ETA la  alcanzó provocándole numerosas heridas muy graves. Como consecuencia de  ellas, Sánchez falleció al día siguiente. Este ataque de ETA se enmarcaba  dentro de su campaña contra intereses económicos franceses.",-2.9349915,43.2630051
1987-03-27,Barcelona,,1,0,"ETA  hizo estallar a distancia un explosivo de 45 kilos junto a una gran batería  de tornillería ocultos en una furgoneta en el puerto de Barcelona, con la  misión de alcanzar a un puesto de vigilancia de la Guardia Civil cercana. El  impacto de la explosión destrozó completamente la caseta y alcanzó a cinco  guardias civiles que se encontraban allí en el momento y a quince personas  más. Uno de los guardias civiles, Antonio González Herrera, terminó  falleciendo en el hospital por la gravedad de sus heridas.",2.1774322,41.3828939
1987-04-02, Barcelona,,1,0,"Juan Fructuoso  Gómez, electricista, murió asesinado por ETA debido a la explosión de un  coche-bomba accionado a distancia. Fructuoso se encontraba hablando por  teléfono y ETA activó el explosivo cuando se disponía a pasar una patrulla de  la Guardia Civil. Gravemente heridos resultaron los guardias civiles Juan  García Estévez y José Manuel Fernández Cubillo, quien quedó ciego. Varios  transeúntes también resultaron heridos y además se produjeron daños  materiales en tres edificios y varios coches estacionados cerca del lugar de  la explosión.",2.1774322,41.3828939
1987-04-25,Portugalete,,1,0,"Siete  jóvenes enmascarados del grupo Mendeku, afín a ETA, lanzaron cócteles molotov  contra la Casa del Pueblo de Portugalete en el momento en que numerosas  personas se encontraban en el local, que también tenía uso de bar. María  Teresa Torrano Francia, ama de casa, y Félix Peña Mazagatos, trabajador de  los astilleros de Sestao, murieron días después del ataque debido a la  gravedad de las quemaduras que les produjeron en su cuerpo. Siete personas  más resultaron heridas.",-3.0199529,43.3191292
1987-05-04,Vitoria-Gasteiz,,1,0,"Un  equipo de artificieros del Cuerpo Nacional de Policía, desactivó en Vitoria  un artefacto explosivo colocado junto a una de las ruedas del vehículo  particular de Juan Pastor, director provincial de Trabajo en Alava y  secretario institucional del Partido Socialista de Euskadi (PSE-PSOE) en esta  provincia.El artefacto fue descubierto por el propio Juan Pastor cuando salía  de su domicilio para dirigirse al trabajo.",-2.6724025,42.8465088
1987-05-17, Madrid,,1,0,"Triple atentado  con bombas de ETA en Madrid. Un coche-bomba colocada por ETA para que  explotara cerca de la Dirección General de la Guardia Civil de Madrid hizo  explosión de madrugada en el momento en que pasaba un coche ocupado por una  familia que volvía de celebrar unas bodas de plata. La onda expansiva alcanzó  y mató a Carmen Pascual Carrillo, ama de casa de 79 años. Además, siete  personas más fueron heridas. La hija de Carmen, María de los Ángeles Ibáñez  resultó herida de gravedad y necesitó 137 días de asistencia sanitaria,  aunque nada pudo hacer para evitar la pérdida de visión por un ojo.  Gravemente heridos también resultaron Luis María Villarroso y su esposa María  del Carmen Fernández (sobrino y sobrina política de Carmen Pascual) y los  transeúntes Florencio Arce y Carlos Marcos.",-3.7035825,40.4167047
1987-05-19,Getxo,,1,0,"Andrés  Gutiérrez Blanco, empresario dueño de una empresa de laminación situada en  Mungia, fue secuestrado por ETA en su propia casa, donde dejaron maniatados a  su mujer, la sirvieta y el portero del edificio. Gutiérrez fue liberado 46  días después en la localidad vizcaína de Godexola, tras el pago por su  rescate.",-3.0087671,43.3479409
1987-06-19,Barcelona,,1,0,"Un  coche bomba estalla en el parking de unos almacenes de Hipercor en Barcelona,  dentro de la campaña de ETA contra intereses económicos franceses y creyendo  que esta firma era de origen galo. ETA había llamado a medios de comunicación  avisando de la colocación del artefacto, pero al no encontrar nada el  personal de seguridad de la empresa ni la policía, decidieron no desalojar el  recinto. Como consecuencia de la explosión murieron 21 personas, todas ellas  civiles que se encontraban en el interior, la mayoría por asfixia. Sus  nombres son: Milagros Amez Franco, Sonia Cabrerizo Mármol, Susana Cabrerizo  Mármol, Felipe Caparrós Ubierna, María Teresa Daza Cecilia, María Paz Diéguez  Fernández, María Emilia Eyre Diéguez, Mercedes Manzanares Servitjá, María del  Carmen Mármol Cubillo, Matilde Martínez Domínguez, Rafael Morales Ocaña,  Mercedes Moreno Moreno, Consuelo Ortega Pérez, Luisa Ramírez Calanda, Luis  Enrique Saltó Viñuales, Bárbara Serret Cervantes, José Valero Sánchez, María  Rosa Valldellou Mestre, Xavier Valls Bauzá, Jordi Vicente Manzanares y Silvia  Vicente Manzanares. Hubo además 46 heridos.",2.1774322,41.3828939
1987-07-14, Oñati,,1,0,"Atentado de ETA  contra un convoy de los Grupos Antiterroristas Rurales de la Guardia Civil  mediante la explosión a distancia de un artefacto en la carretera que une  Oñati y Legazpi. Como resultado, los guardias civiles Pedro Galnares Barrera  y Antonio Ángel López Martínez-Colmenero murieron, y otros doce agentes  fueron heridos de diversa consideración. La explosión alcanzó de lleno a la  primera furgoneta en que viajaban las dos víctimas mortales.",-2.4137149,43.0328523
1987-08-06,Vitoria-Gasteiz,,1,0,"ETA  colocó un coche-bomba en una curva situado en el vitoriano barrio de  Armentia. Al paso de dos vehículos de la Policía Nacional los terroristas  activaron a distancia el dispositivo, cuya explosión alcanzó al segundo  vehículo de lleno. Como consecuencia murieron los agentes Rafael Mucientes  Sanz y Antonio Ligero Hec, y la transeúnte Obdulia Vega Solac resultó herida.",-2.6724025,42.8465088
1987-08-07,Zarautz,,1,0,"Varias  granadas salieron disparadas de una furgoneta colocada por miembros de ETA  para atacar a distancia una casa-cuartel de la Guardia Civil en Zarautz. Como  resultado, el bebé de 12 meses Borja Blanco y su abuela de 60 años Adriana  Blanco resultaron heridos, de gravedad en el caso del bebé puesto que tenía  metralla incrustada en el cerebro. También fueron heridos sus padres y su  hermano de siete años.",-2.1723467,43.2834873
1987-09-08, Bilbao,,1,0,"Dos terroristas  de ETA esperaron al subteniente de la Guardia Civil Cristóbal Martín Luengo  cerca de su domicilio y, en el momento en el que él pasó por dicho lugar, se  le acercaron por detrás y lo asesinaron de un tiro en la nuca. Los  terroristas se dieron a la fuga en un taxi robado en el que les esperaba otro  compañero.",-2.9349915,43.2630051
1987-09-09,Gernika-Lumo,,1,0,Son  asesinados en Gernika el cabo de la Guardia Civil Federico Carro Jiménez y el  agente Manuel Ávila García al estallar un coche bomba que inspeccionaban en  las inmediaciones del cuartel y que fue accionado a distancia por un miembro  de ETA.,-2.6778511,43.3143628
1987-09-26,Barakaldo,,1,0,"El  agente de la Policía Nacional Vicente Montoya Salazar fue asesinado con una  bomba-lapa por ETA cuando la activó al girar la llave de contacto de su coche  al disponerse a ir a trabajar. La explosión provocó que le amputaran ambas  piernas, quemaduras y traumatismos que hicieron que días más tarde muriera en  el hospital. Su esposa Crescencia García resultó herida en la cara, puesto  que se encontraba en la ventana de su casa despidiéndose de su marido.",-2.9900933,43.29548
1987-09-27,San Sebastián,,1,0,"Una  furgoneta de la Policía Nacional que circulaba por las calles de San  Sebastián fue alcanzada por la explosión de un coche-bomba activado a  distancia por miembros de ETA. El conductor de la furgoneta, Wenceslao Maya  Vázquez, murió debido a las heridas producidas, y además fueron heridos de  gravedad otros cuatro compañeros que viajaban en la furgoneta: Miguel  Hernández, Isidro Gallego, Miguel Ángel Rodríguez y Manuel Marudi También  resultaron heridos dos viandantes de origen canadiense.",-1.9838889,43.3224219
1987-10-17, Pamplona,,1,0,"María Cruz  Yoldi Orradre, repartidora de periódicos, murió asesinada por un artefacto  explosivo colocado por ETA en la puerta de la compañía de seguros La Unión y  el Fénix Español. ETA atentó contra dicha compañía dentro de su campaña  contra intereses económicos españoles y franceses. Yoldi se encontraba  trabajando en el momento en que fue alcanzada por la explosión. ETA había  realizado varias llamadas para indicar la colocación de la bomba, pero la  Policía no pudo encontrarla con los datos aportados.",-1.6442556,42.8184538
1987-11-01,Ordizia,,1,0,"El  cabo primero de la Guardia Civil Antonio Mateo Melero fue asesinado en  Ordizia por dos jóvenes, un hombre y una mujer miembros de un comando de ETA  Militar, que le dispararon varias veces en la cabeza cuando se encontraba  acompañado por su esposa y varios familiares y amigos frente a un bar.",-2.1795046,43.0539687
1987-12-11,Zaragoza,,1,0,"Un  coche bomba estalla frente a la casa cuartel de la Guardia Civil en Zaragoza.  En el atentado mueren once personas entre agentes y familiares de los mismos,  de los cuales seis eran menores de edad. Los fallecidos son Emilio Capilla,  su esposa Dolores Franco y la hija de ambos Rocío Capilla Franco, el agente  José Pino Arriero, su esposa Mari Carmen Fernández Muñoz y la hija de ambos  Silvia Pino Fernández, el agente José Ballarín Gaya y su hija Silvia  Ballarín, los agentes Ángel Alcaraz Martos, José Luis Gómez Solís y las  hermanas Miriam Barrera Alcaraz y Esther Barrera Alcaraz. Además hubo 73  heridos, de los que la mayoría no eran guardias civiles.",-0.8809428,41.6521342
