fecha,localidad,pais,numero_victimas,numero_heridos,descripcion,latitude,longitude
1960-06-28,San Sebastián,España,1,6,"La primera víctima mortal fue Begoña Urroz, quien tenía apenas 22 meses cuando una bomba incendiaria colocada en la estación de Amara, San Sebastián. Explotaron en total cinco artefactos, también en otras estaciones de tren españolas. Resultaron heridos Carlos Íñigo Acevedo (Estación del Norte), Valeriano Bakaikoa Azurmendi (15 años), Soledad Arruti (60 años), Pascual Ibáñez Martín (29 años), Francisco Sánchez Bravo (42 años) y María García Moras (49 años).",43.320812,-1.984447
1961-07-18,San Sebastián,España,0,0,Intento fallido de descarrilamiento de un tren ocupado por voluntarios franquistas que se dirigían a San Sebastián para celebrar el Alzamiento.,43.320812,-1.984447
1968-06-07,Villabona,España,1,0,"Primer atentado no planificado de ETA. El guardia civil José Antonio Pardines, de 25 años, fue tiroteado hasta la muerte por los terroristas Txabi Echebarrieta e Iñaki Sarasketa tras solicitarles la documentación. Ocurrió en la localidad guipuzcoana de Villabona. La persecución de los agresores tiene como resultado la muerte de uno de ellos, Francisco Javier Echevarrieta, de 24 años y miembro de ETA.",43.189944,-2.052454
1968-08-02,Irun,España,1,0,"Considerado el primer atentado planificado de ETA. Al llegar a la puerta de casa, el agresor le disparó por la espalda a Melitón Manzanas, Inspector Jefe de la policía municipal y jefe de la Brigada Social, quitándole la vida.",43.338233,-1.789272
1969-04-09,Arrigorriaga,España,1,0,"Un miembro de ETA que huía de la policía dispara cuatro tiros al taxista Fermín Monasterio Pérez, de 38 años, cuando éste se negó a llevarle donde quería. Posteriormente sacó el cuerpo del taxi, lo dejó en el suelo y se dio a la fuga.",43.20752,-2.887839
1972-08-29,Galdácano,España,1,1,"Dos policías municipales retuvieron en Galdácano un taxi que transportaba a cuatro sospechosos. Al no disponer éstos de la documentación, los municipales se llevaron a los sospechosos al cuartelillo de la guardia municipal del pueblo, acompañados por una pareja de la Guardia Civil. A la llegada al cuartelillo, uno de los sospechosos inició un forcejeo que se tradujo en la muerte del policía municipal Eloy García Cambra de 44 años e hirió a Herminio Nobreda. Los sospechosos consiguieron huir.",43.230556,-2.845833
1973-03-24,San Juan de Luz,Francia,3,0,"José Humberto Fouz Escobedo (28 años - Empleado en una empresa de transportes), Fernando Quiroga Veiga (25 años - Empleado en una agencia de aduanas) y Jorge Juan García Carneiro (23 años - Parado), tres jóvenes de origen gallego y residentes en Irun cruzaron la frontera para ver una película entonces prohibida en España. Fueron confundidos con policías y asesinados. Nunca se supo nada de sus restos.",43.3903,-1.66667
1973-12-20,Madrid,España,3,4,"Explosión de una bomba subterránea al paso del coche en el que iba el entonces Presidente del Gobierno de Franco, el almirante Luis Carrero Blanco. Fallecieron tanto él como los otros dos ocupantes del coche: José Luis Pérez Mogena (chófer del presidente) y José Antonio Bueno Fernández (escolta). Resultaron heridos Rafael Galiana del Río (policía), Carlos del Pozo (taxista), un niño de 10 o 12 años y la dependienta de una tienda cercana. ",40.434278,-3.6855
1974-04-03,Azpeitia,España,1,0,"Dos miembros de ETA se pusieron delante y acribillaron a tiros un vehículo ocupado por el cabo primero de la Guardia Civil Gregorio Posada Zurrón, a quien quitaron la vida. ETA reivindica el atentado y declara que, a partir de entonces, incluía a todos los agentes policiales como objetivo militar. ",43.1839,-2.265466
1974-05-31,Beasain,España,0,0,"Cuatro miembros de ETA armados con subfusiles atracaron la Compañía Auxiliar de Ferrocarriles en Beasain, llevándose las nóminas de unos cien obreros,  unos catorce millones de pesetas. Unas doce horas después del atraco, cometido con la complicidad de un trabajador de la compañía, la guardia civil localizó un vehículo sospechoso cuyos integrantes se refugiaron en un edificio en ruinas.  Tras un tiroteo, los agentes recuperaron casi todo el dinero y arrestaron a uno de los asaltantes.",43.047076,-2.204605
1974-06-02,Ataun,España,1,0,"Una patrulla de la Guardia Civil que circulaba por el barrio de Ergoyena, en Ataun, dio el alto a dos hombres y una mujer para identificarlos. Uno de los hombres disparó contra el guardia civil Manuel Pérez, hiriéndole de muerte y dándose a la fuga.",43,-2.166667
1974-09-11,Bilbao,España,1,3,"Agentes de la Guardia Civil se encontraban en un piso que parecía que estaba siendo utilizado por ETA. En ese momento, y tras detener a María Dolores González Catarain 'Yoyes', llegaron otros dos miembros de ETA, de los que apresaron uno y el otro (Juan José Urcelay Imaz) se dio a la fuga por las escaleras. Le persiguió el guardia civil Martín Durán, quien resultó herido de muerte por dos disparos. El perseguido efectuó más disparos en la calle, hiriendo a una persona viandante, Andrea Villamore,  por disparo en el glúteo. La persecución del fugitivo continuó y, horas más tarde, se produjo otro tiroteo en el que murió el etarra Juan José Urcelay y resultaron heridos otro activista y dos guardias civiles.",43.256963,-2.923441
1974-09-13,Madrid,España,13,75,"ETA hizo estallar una bomba colocada en los aseos del restaurante Rolando de Madrid, provocando una masacre que quitó la vida a 13 personas e hirió a unos 75. La banda terrorista creía que la cafetería estaría llena de policías, debido a su proximidad con la Dirección General de Seguridad. Los fallecidos fueron Antonio Alonso Palacín (empleado en una fábrica de motores), María Jesús Arcos Tirado (28 años - Telefonista), Francisca Baeza Alarcón (45 años - Maestra), Baldomero Barral Fernández (24 años - Panadero), María Josefina Pérez Martínez (21 años - Ama de casa), Gerardo García Pérez (Camarero), Francisco Gómez Vaquero (31 años - Cocinero), Antonio Lobo Aguado (Ferroviario), Manuel Llanos Gancedo (26 años - Camarero), Luis Martínez Marín (77 años - Agente comercial), Concepción Pérez Paino (65 años - Administrativa) y María Ángeles Rey Martínez (20 años - Estudiante). Félix Ayuso Pinel (57 años - Inspector de Policía) murió el 11 de enero de 1977 como consecuencia de las graves heridas. Hubo además 75 heridos.",40.4161111,-3.704166667
1974-10-29,Pasajes,España,1,0,"Dos guardias civiles dieron el alto a un sospechoso en el barrio de Trincherpe (Pasajes). El sospechoso era el miembro de ETA Ignacio Iparraguirre, quien sacó una pistola y disparó en el pecho al sargento Jerónimo Vera, a quien hirió de muerte. En el tiroteo que se desencadenó también fue herido de gravedad el terrorista Ignacio Iparraguirre, que murió días más tarde.",43.3239952,-1.9200587
1974-12-17,Mondragón,España,2,0,"Dos guardias civiles, Luis Santos Hernández (52 años - Subteniente de la Guardia civil) y Argimiro García Estévez (50 años - Guardia civil), caminaban por las calles de Mondragón tras tomar un vino en un bar. Entonces, un coche se colocó a su altura y sus ocupantes dispararon una ráfaga de ametralladora que quitó la vida a los agentes Luis Santos y Argimiro García.",43.0656783,-2.4900779
1975-03-29,San Sebastián,España,1,0,"Dos miembros de ETA lanzaron una ráfaga de metralleta sobre el subinspector de policía José Díaz Linares, de 29 años, que recibió nueve impactos de bala lo que produjo su muerte. Estaban esperándole en una furgoneta aparcada frente a su casa y, para atacarle, aprovecharon el momento en que José Díaz salió de su domicilio para coger su coche.",43.320812,-1.984447
1975-04-22,Getxo,España,1,0,"El inspector de policía José Ramón Morán, de 33 años, se dirigía a su ocupación diaria en la comisaría de Getxo cuando dos individuos salieron de un coche y le dispararon con una escopeta de caza por la espalda, produciéndole la muerte.",43.344167,-3.006389
1975-05-06,Guernica y Luno,España,1,0,"Un miembro de ETA camuflado disparó por la espalda con una metralleta al guardia civil Andrés Segovia Peralta de 40 años, cuando éste caminaba por las vías de tren de Guernica hacia el cuartel de la Guardia Civil. Los 20 impactos de bala recibidos le quitaron la vida.",43.3143628,-2.6778511
1975-05-07,Bilbao,España,1,0,"Dos miembros de ETA esperaron escondidos a que el Inspector de policía Fernando Llorente, de 51 años, volviera a su casa tras su jornada de trabajo. Al llegar éste a su portal, los terroristas le dispararon seis disparos en el cuerpo que le hirieron de muerte.",43.256963,-2.923441
1975-05-13,Guernica y Luno,España,3,0,"La Guardia Civil acudió a un supuesto piso franco de ETA en Guernica y Luno. Llamaron a la puerta del piso, en el que había un matrimonio y dos jóvenes. En el momento en que el matrimonio abría la puerta y atendía a los guardias civiles, los dos jóvenes trataron de escapar de la vivienda por la ventana. Entonces fue cuando dispararon  e hirieron de muerte al Teniente de la Guardia Civil de 48 años Domingo Sánchez. En el tiroteo que se desencadenó también murió el terrorista Jesús María Markiegui de 20 años y el matrimonio, Ignacio Garay Lejarreta de 53  y Blanca Saralegui Allende de 42 años.",43.344167,-3.006389
1975-06-05,San Sebastián,España,1,0,"Dos individuos vestidos con gabardinas en un día con buena meteorología llamaron la atención del guardia civil Higinio Martín, de 37 años, quien desenfundó su pistola y se acercó a ellos para identificarlos. Los sospechosos retrocedieron, agachándose uno y disparando al guardia civil el otro. Una de las balas rompió un cristal del que algún trozo se incrustó en el ojo de Higinio Martín, lo que aprovecharon los sospechosos para darse a la fuga de un vagón a otro. Los guardias civiles fueron a cubrir las puertas de cada uno de los extremos del tren. En esta acción salió despedido el otro guardia civil, Mariano Román Madroñal, quien al caer del tren perdió la vida de forma instantánea por un golpe en el cráneo.",43.320812,-1.984447
1975-06-06,Barcelona,España,1,0,"Un grupo de etarras entró en unas oficinas bancarias para acometer un atraco. Una empleada activó la alarma conectada a la Jefatura de la Policía y, rápidamente, una patrulla acudió al lugar del atraco. Al salir de la sucursal bancaria, los etarras se toparon con los policías y se produjo un tiroteo, resultando herido de muerte el policía Ovidio Díaz López, Cabo 1ª de la Policía Armada de 31 años. Un mes después fue detenido Jon Paredes Manot 'Txiki', acusado de participar en el tiroteo. Fue condenado a muerte y ejecutado el 27 de septiembre de 1975.",41.3974988,2.1815631
1975-07-05,Deba,España,1,0,"Dos terroristas de ETA que viajaban en un autobús entre Deba e Itziar obligaron al conductor Carlos Arguimberri Elorriaga, de 43 años, a detener el autocar a un lado de la carretera. Mientras uno le asesinó asestándole nueve balazos, el otro vigilaba a los viajeros, entre los que se encontraban un hermano y una hermana de Arguimberri.",43.294141,-2.3539311
1975-07-31,Usurbil,España,1,0,"Dos terroristas de ETA se acercaron al taxi situado en la parada de Usurbil, en el que Francisco Expósito Camini, taxista de 54 años, esperaba nuevos clientes. Le mataron disparándole a bocajarro. Huyeron en un coche que les estaba esperando y desde el que lanzaron propaganda en la que se acusaba a Expósito de ser confidente de la Guardia Civil.",43.2703088,-2.0502559
1975-08-08,Hernani,España,1,0,"Tres terroristas de ETA esperaron dentro de un automóvil a que Demetrio Lesmes Martín, guarda jurado de 54 años, terminara su jornada laboral en una fábrica y volviera a casa. Dos terroristas bajaron del coche, anduvieron hacia la altura de Lesmes y le asesinaron tras abrir fuego contra él. Era la segunda vez que atentaban contra él.",43.267549,-1.975814
1975-10-05,Oñate,España,3,2,"Un todoterreno de la Guardia Civil acudió al Santuario de Aránzazu, próximo a Oñate, para retirar una ikurriña allí desplegada (algo ilegal en la época). En el regreso al cuartel, estalló un artefacto explosivo cubierto con unos trescientos tornillos que ejercían de metralla que alcanzó de lleno al vehículo, ocupado por cinco guardias civiles, de los que fallecieron tres, Esteban Maldonado Llorente (20 años - Guardia civil), Jesús Pascual Martín Lozano (25 años - Guardia civil) y Juan Moreno Chamorro (26 años - Guardia civil), y los otros dos, Jesús Gómez Castillo (28 años - Guardia civil) y Juan García Lorente (27 años - Guardia civil), resultaron gravemente heridos.",43.0328523,-2.4137149
1975-10-12,Villarreal de Álava,España,1,0," Legutiano (Álava) El taxista Germán Aguirre Irazuegui, de 35 años, fue contratado para hacer un servicio a medianoche de Mondragón a Villarreal de Álava. Cerca de esta localidad, el taxista fue obligado a desviarse hacia un descampado junto a un embalse donde, fuera del coche, lo asesinaron de varios disparos.",42.9791587,-2.6426345
1975-10-18,Zarauz,España,1,0,"Miembros de ETA esperaron en la calle a que el guardia civil Manuel López Treviño, de 48 años, saliera del cuartel con rumbo a su domicilio. Después de seguirle un rato, los terroristas dispararon una ráfaga de metralleta de la que tres balas le alcanzaron la cabeza, quitándole la vida.",43.2834873,-2.1723467
1975-11-24,Oyarzun,España,1,0,"Antonio Echeverría Albisu,  de 33 años y edil de Oiartzun desde hacía poco más de un año, era el alcalde más joven de Guipúzcoa. A las 14.30 horas del 24 de noviembre de 1975, un desconocido de unos 25 años llamó a la puerta de su casa y, cuando un familiar abrió, dijo que tenía un encargo urgente para Antonio de parte del alcalde de Hernani. La víctima salió a la puerta y en ese momento el desconocido le disparó con una pistola a la altura del pecho. Este atentado supuso el primero de una campaña de acciones violentas contra cargos municipales y forales que se prolongó años.",43.29828,-1.86129
1976-01-17,Ordicia,España,1,2,"Un coche de la Guardia Civil que estaba de servicio en las proximidades de Ordizia divisó una ikurriña sujetada por un mástil colocado en una loma junto a la carretera. Al ir a retirarla el guardia civil Manuel Vergara, de 21 años, el mecanismo explosivo conectado al mástil explotó y lanzó su cuerpo a 17 metros de distancia. Resultaron heridos dos guradias civiles con heridas leves.",43.06376,-2.18183
1976-02-09,Galdácano,España,1,2,"El alcalde de Galdácano Victor Legorburu Ibarreche, de 63 años,  bajó de su casa a la calle, donde le esperaba una escolta de la policía municipal, para dirigirse a su trabajo. Uno de los escoltas le acompañó a pie hasta su coche, mientras el otro se quedó en el coche de la policía. Al tomar una calle, Legorburu y el escolta Francisco Ruiz se vieron sorprendidos por una ráfaga de metralleta disparada por tres individuos. Los doce balazos que impactaron en Legorburu le quitaron la vida, mientras que Ruiz quedó gravemente herido por once impactos de bala y Gerardo García Romero sufrió heridas en una mano. En el lugar se recogieron 40 casquillos de bala. Los agresores escaparon en un coche en el que les esperaba otro miembro de ETA.",43.230556,-2.845833
1976-02-10,Cizúrquil,España,1,0,"Asesinado a tiros tras ser confundido con el alcalde de Cizúrquil. Dos días después, ETA emitió un comunicado reconociendo haberse equivocado.",43.1992503,-2.0741092
1976-03-01,Lezo,España,1,0,Asesinado a tiros bajo la acusación de ser confidente de la Policía.,43.321127,-1.898775
1976-03-13,Guetaria,España,1,0,"Dos disparos en la cabeza, tras ser obligado a desviarse con su taxi a un camino alejado de la carretera.",43.303261,-2.204363
1976-03-18,San Sebastián,España,1,0,Secuestrado. Tiro en la nuca. Komando Bereziak (Comandos Especiales) de ETA (pm),43.320812,-1.984447
1976-03-30,Placencia de las Armas,España,1,0,"Disparo a bocajarro en la cabeza por parte de dos miembros de ETA, cuando se dirigía a su trabajo. Mientras huían en coche, dejaron caer una granada alemana, que no detonó por tener puesto el seguro.",43.1742777,-2.4128759
1976-04-04,Hendaya,Francia,2,0,"Disparo, tras ser secuestrados y torturados. Sus cadáveres fueron encontrados en Anglet, el 19 de 4 de 1977.",43.3641518,-1.7616499
1976-04-11,Baracaldo,España,1,0,Electrocutado cuando se disponía a retirar una ikurriña colocada sobre unos cables de tendido eléctrico.,43.29548,-2.9900933
1976-05-03,Legazpia,España,1,0,Explosión de una bomba al paso del vehículo policial en el que viajaba.,43.054361,-2.333641
1976-06-09,Basauri,España,1,0,"Asesinado a tiros cuando se dirigía al instituto, donde ejercía de profesor.",43.222177,-2.885668
1976-10-04,San Sebastián,España,5,0,"El lunes 4 de octubre de 1976, un comando de ETA-m, adiestrado en la academia de la policía argelina en Souma, asesinó en San Sebastián al presidente de la Diputación de Guipúzcoa, Juan María de Araluce, su conductor José María Elícegui y los tres policías de escolta Alfredo García González, Antonio Palomo Pérez y Luis Francisco Sanz Flores. Fue uno de los atentados más sangrientos de los años de plomo",43.320812,-1.984447
1977-03-13,Mondragón,España,1,0,"Cuatro guardias  civiles y la novia de uno de ellos abandonaban de madrugada una discoteca de  Mondragón y se disponían a volver a su puesto de Oñate. En una señal de  'Stop', el coche que iba delante del que ocupaban se detuvo y de él se  bajaron dos jóvenes con escopetas. Descargaron dos ráfagas, asesinando a  Constantino Gómez Barcia, de 21 años, e hiriendo a dos compañeros, uno de  mucha gravedad. Los heridos son Miguel Santaella Carretero (25 años - Guardia  civil) y José Castaño Vázquez (26 años - Guardia civil).",43.0656783,-2.4900779
1977-04-29,Tolosa,España,1,0,"Varios  miembros de ETA político-militar atracaron una sucursal bancaria en Tolosa,  haciéndose con un botín de 20 millones de pesetas. Tras el atraco, el guardia  civil Antonio Galán Aceituno, de 47 años, se desplazó hasta el lugar para  iniciar las diligencias correspondientes. Entonces, otro comando de ETA,  aunque esta vez de la rama militar, entró en la oficina para realizar otro  atraco. Uno de los asaltantes iba disfrazado de guardia civil, lo que  distrajo a Galán, quien pereció tras recibir los balazos de una ráfaga de  metralleta.",43.6044622,1.4442469
1977-05-18, San Sebastián,España,1,0,"Dos miembros de  ETA llegaron en un coche robado a la estación de ferrocarril de Amara, donde  penetraron y dispararon al agente de policía que allí se encontraba de  guardia, Manuel Orceda de la Cruz, de 23 años, provocando su muerte. Los  terroristas escaparon en el mismo coche en que llegaron.",43.3224219,-1.9838889
1977-05-20,Getxo y Alto de Barazar,España,1,0,"Cuatro  miembros de ETA se presentaron en la casa de Javier de Ybarra y Bergé,  industrial de 63 años, disfrazados de enfermeros. Después de reunir a todos  los familiares que se encontraban en la casa en una habitación y sacar unas  fotos, se llevaron secuestrado al industrial. Por su rescate, pedían a la  familia mil millones de pesetas para no ejecutar al rehén. La familia no pudo  reunir el dinero y el día 20 de junio, un mes después de producirse el  secuestro, Radio Popular de San Sebastián recibió un comunicado que anunciaba  la ejecución de Ybarra con un plano del lugar en el que se encontraba el  cuerpo.",43.344167,-3.006389
1977-06-27,La Puebla de Arganzón,España,1,0,"El  policía armada Valentín Godoy Cerezo, de 29 años, destinado en  Vitoria-Gasteiz, fue encontrado muerto en el interior su coche. El automóvil  se encontraba junto a la carretera N-I, tenía las luces encendidas y el  cuerpo sin vida del agente se encontraba reclinado en el asiento derecho, con  tres disparos en la cabeza realizados a corta distancia y desde atrás.",42.7666976,-2.8309644
1977-10-08,Gernika-Lumo,España,1,0,"Augusto  Unceta-Barrenechea Azpiri, de 53 años, Presidente de la Diputación vizcaína y  antiguo alcalde de Gernika, fue, como todos los sábados, al frontón de esta  localidad para jugar con unos amigos un partido de pala. Fue en su coche  acompañado por otro coche con dos guardias civiles escoltas. Al llegar a las  instalaciones y bajar del coche recibió un disparo a la cabeza primero y  después una ráfaga de metralleta. En total, 11 impactos de bala. Sus  escoltas, Antonio Hernández-Fernández Segura, de 23 años, y Ángel Antonio  Ribera navarrón trataron de alejarse de las ráfagas de balas, pero chocaron  con su coche y antes de poder defenderse fueron también ametrallados. Tras el  multitudinario funeral celebrado en Gernika, se congregó un grupo de algo más  de medio centenar de manifestantes de Fuerza Nueva que recorrieron algunas  calles del pueblo, algunos de ellos armados, gritando vivas a España, al  ejército o entonando el ""Cara al sol"".",43.3143628,-2.6778511
1977-11-02, Irún,España,1,0,"El sargento de  la Policía Municipal José DíazFernández, de 54 años, volvía a pie de su  trabajo a su domicilio para comer un bocadillo y después volver a trabajar.  Al entrar en su domicilio, tres individuos que allí le esperaban le  dispararon por la espalda causándole la muerte. Los terroristas llegaron al  lugar en un taxi robado, después de hacer rehén a su dueño y amordazarlo en  un árbol situado en un monte cercano a Irún. El taxista fue encontrado esa  misma madrugada.",43.3383176,-1.7888095
1977-11-26,Pamplona,España,1,0,"Después  de dar una vuelta con sus amigos, el comandante  de Infantería de la Policía Armada,  Joaquín Imaz, de 54 años, se dirigió hacia la plaza de toros de Pamplona para  coger su coche y volver a casa. En el lugar donde se encontraba su automóvil  le esperaban varios terroristas, que dispararon a Imaz por la espalda varios  tiros y, cuando yacía en el suelo, lo remataron con un tiro en la sien.",42.8184538,-1.6442556
1977-12-16,Irún,España,1,0,"El  concejal de Irún Julio Martínez Ezquerro, de 46 años, volvía a casa en coche  tras una reunión en el ayuntamiento. Cuando se apeó del automóvil para abrir  la puerta del garaje, varios terroristas le dispararon a quemarropa. Murió de  forma instantánea. Martínez era uno de los cuatro concejales de la  corporación irundarra que no había dimitido a causa de la situación política.",43.3383176,-1.7888095
1978-01-11, Pamplona,España,1,0,"Una brigada de  información de la policía de Pamplona había recabado pistas sobre actividades  de terroristas de ETA en Navarra. El inspector José Manuel Baena Martín  pertenecía a dicha unidad, que se dispuso a acudir a un piso en el que  sospechaban que se escondían varios terroristas. Al subir por las escaleras  del inmueble junto a otros compañeros, coincidió que varios miembros de ETA  entraron al portal y, al ver a los policías, abrieron fuego contra ellos. En  el tiroteo que se produjo fue mortalmente herido el inspector Baena. Los  disparos entre terroristas y policía continuaron en la calle, donde fueron  alcanzados también mortalmente los etarras Ceferino Sarasola de 28 años,  trabajador de una fábrica de muebles, y Joaquín Pérez de Viñaspre Churruca de  24 años, estudiante de medicina. Varios viandantes resultaron heridos y  tuvieron que ser ingresados en el hospital.",42.8184538,-1.6442556
1978-02-24,Santurce,España,1,0,"El  policía municipal Manuel Lemus Noy, de 46 años, se encontraba en una  marquesina esperando al autobús para ir a trabajar cuando fue ametrallado por  miembros de ETA que viajaban en el interior de un coche. Fue alcanzado por  dos balas, cuyas heridas terminaron quitándole la vida el día 6 de abril. En  el funeral se produjeron tensiones y enfrentamientos provocados por personas  de ultraderecha, así como varios heridos leves.",43.3287527,-3.0318766
1978-03-05,Vitoria-Gasteiz,España,1,0,"Miembros  del Comando Araba de ETA robaron un coche en el aparcamiento de un hospital y  se desplazaron hasta una zona por donde debía pasar un coche de la Policía  Nacional. A su paso, dos o tres terroristas dispararon varias ráfagas de  metralleta contra el coche. Los etarras se dieron a la fuga y abandonaron el  coche. En el ataque murieron tres policías nacionales, Joaquín Ramos Gómez  (26 años - Policía nacional), Miguel Raya Aguilar (26 años - Policía  nacional) y José Vicente del Val del Río (21 años - Policía nacional)  y otros dos fueron heridos, Armando  Doval González (21 años - Policía nacional) y Santiago del Canto de los Reyes  (24 años - Policía nacional). El copiloto resultó ileso.",42.8465088,-2.6724025
1978-03-10,Aduna,España,1,0,"El  guardia civil retirado José María Acedo Panizo, de 56 años, se encontraba  trabajando como jefe de porteros en una empresa de la localidad guipuzcoana  de Aduna cuando un terrorista de ETA se acercó a él y lo asesinó a tiros.  Acedo trató de escapar, pero el terrorista lo impidió agarrándolo y  rematándolo con un disparo en la cabeza.",43.2038168,-2.050099
1978-03-16,Galdácano,España,1,0,"Esteban  Beldarrain Madariaga, de 52 años, trabajador en un peaje de autopista, había  sido teniente alcalde de la localidad de Castillo-Elejabeitia. Llevaba  teniendo amenazas de ETA durante más de un año, a raíz de unos incidentes que  protagonizó cuando disparó con su escopeta contra una ikurriña colocada en la  plaza de Galdácano. Una noche, un comando de ETA se apoderó de un taxi y se  dirigieron al peaje donde trabajaba Beldarrain. Al llegar a su cabina le  dispararon seis balazos que le causaron la muerte.",43.2332639,-2.8453385
